{
  "_type": "sec_certs.sample.cc.CCCertificate",
  "dgst": "265b6e29d58940b7",
  "status": "archived",
  "category": "Access Control Devices and Systems",
  "name": "Sample certificate name",
  "manufacturer": "Sample manufacturer",
  "scheme": "DE",
  "security_level": {
    "_type": "Set",
    "elements": [
      "Sample security level"
    ]
  },
  "not_valid_before": "1900-01-02",
  "not_valid_after": "1900-01-03",
  "manufacturer_web": "https://path.to/manufacturer/web",
  "protection_profile_links": {
    "_type": "Set",
    "elements": [
      "https://sample.pp"
    ]
  },
  "maintenance_updates": {
    "_type": "Set",
    "elements": [
      {
        "_type": "sec_certs.sample.cc.CCCertificate.MaintenanceReport",
        "maintenance_date": "1900-01-01",
        "maintenance_title": "Sample maintenance",
        "maintenance_report_link": "https://maintenance.up",
        "maintenance_st_link": "https://maintenance.up"
      }
    ]
  },
  "state": {
    "_type": "sec_certs.sample.cc_eucc_common.InternalState",
    "report": {
      "_type": "sec_certs.sample.document_state.DocumentState",
      "download_ok": false,
      "convert_ok": false,
      "extract_ok": false,
      "source_hash": null,
      "txt_hash": null,
      "json_hash": null
    },
    "st": {
      "_type": "sec_certs.sample.document_state.DocumentState",
      "download_ok": false,
      "convert_ok": false,
      "extract_ok": false,
      "source_hash": null,
      "txt_hash": null,
      "json_hash": null
    },
    "cert": {
      "_type": "sec_certs.sample.document_state.DocumentState",
      "download_ok": false,
      "convert_ok": false,
      "extract_ok": false,
      "source_hash": null,
      "txt_hash": null,
      "json_hash": null
    }
  },
  "pdf_data": {
    "_type": "sec_certs.sample.cc_eucc_common.PdfData",
    "report_metadata": null,
    "st_metadata": null,
    "cert_metadata": null,
    "report_frontpage": null,
    "st_frontpage": null,
    "cert_frontpage": null,
    "report_keywords": null,
    "st_keywords": null,
    "cert_keywords": null,
    "report_filename": null,
    "st_filename": null,
    "cert_filename": null
  },
  "heuristics": {
    "_type": "sec_certs.sample.cc_eucc_common.Heuristics",
    "extracted_versions": null,
    "cpe_matches": null,
    "verified_cpe_matches": null,
    "related_cves": null,
    "cert_lab": null,
    "cert_id": null,
    "annotated_references": null,
    "extracted_sars": null,
    "direct_transitive_cves": null,
    "indirect_transitive_cves": null,
    "next_certificates": null,
    "prev_certificates": null,
    "report_references": {
      "_type": "sec_certs.sample.certificate.References",
      "directly_referenced_by": null,
      "directly_referencing": null,
      "indirectly_referenced_by": null,
      "indirectly_referencing": null
    },
    "st_references": {
      "_type": "sec_certs.sample.certificate.References",
      "directly_referenced_by": null,
      "directly_referencing": null,
      "indirectly_referenced_by": null,
      "indirectly_referencing": null
    },
    "scheme_data": null,
    "protection_profiles": null,
    "eal": null
  },
  "report_link": "https://path.to/report/link",
  "st_link": "https://path.to/st/link",
  "cert_link": "https://path.to/cert/link"
}
